{
  "$ref": "#/definitions/blog",
  "definitions": {
    "blog": {
      "type": "object",
      "properties": {
        "title": {
          "type": "string"
        },
        "slug": {
          "type": "string"
        },
        "date": {
          "type": "string"
        },
        "category": {
          "type": "string"
        },
        "readTime": {
          "type": "string"
        },
        "summary": {
          "type": "string"
        },
        "$schema": {
          "type": "string"
        }
      },
      "required": [
        "title",
        "date",
        "category",
        "readTime",
        "summary"
      ],
      "additionalProperties": false
    }
  },
  "$schema": "http://json-schema.org/draft-07/schema#"
}