[
  {
    "title": "Perbedaan Karakteristik Bahan Nagata Drill vs American Drill untuk Kemeja PDH",
    "slug": "perbedaan-bahan-nagata-drill-vs-american-drill",
    "category": "Panduan Bahan",
    "date": "18 Oktober 2024",
    "readTime": "5 Menit Baca",
    "summary": "Banyak panitia pengadaan bingung memilih antara Nagata Drill dan American Drill. Pelajari perbedaan komposisi serat katun, ketahanan warna, kelembutan, dan perbandingan harga di sini."
  },
  {
    "title": "5 Tips Memilih Jenis Sablon Kaos Acara Gathering Perusahaan Agar Tidak Pecah",
    "slug": "tips-memilih-jenis-sablon-kaos-gathering-perusahaan",
    "category": "Teknik Sablon",
    "date": "12 Oktober 2024",
    "readTime": "4 Menit Baca",
    "summary": "Perbandingan mendalam antara sablon Plastisol, DTF (Direct Transfer Film), Rubber, dan Discharge untuk kaos Cotton Combed 24s/30s agar awet meski dicuci mesin berulang kali."
  },
  {
    "title": "Standar Keselamatan Wearpack K3: Panduan Memilih Scotchlite Reflective 3M",
    "slug": "standar-keselamatan-wearpack-k3-scotchlite-reflective",
    "category": "Safety Garment",
    "date": "05 Oktober 2024",
    "readTime": "6 Menit Baca",
    "summary": "Mengapa kualitas pita reflektif sangat vital untuk keselamatan pekerja tambang dan proyek malam hari? Kenali standar visibilitas EN471 dan ketahanan cuci material pita keselamatan."
  },
  {
    "title": "Mengapa Polo Shirt Lacoste CVC Menjadi Primadona Seragam Semi-Formal Kantor?",
    "slug": "keunggulan-polo-shirt-lacoste-cvc-seragam-kantor",
    "category": "Tips Seragam B2B",
    "date": "28 September 2024",
    "readTime": "4 Menit Baca",
    "summary": "Kombinasi 60% katun dan 40% poliester menjadikan Lacoste CVC tahan susut, tidak melengkung di bagian kerah rajut, serta tetap sejuk dipakai di area tropis."
  }
]
